Document,Primary Introducer,Status,Description,Document ID
LB1059,Wayne,Withdrawn,"Prohibit certain appropriations to the Supreme Court, prohibit certain entities from accepting appropriations, and change provisions relating to the source of certain funds",34374
LB1060,Wayne,Indefinitely postponed,Adopt the Healthy Kids Act and require tests for lead-based hazards in housing,34639
LB1061,Wayne,Indefinitely postponed,State intent relating to appropriations relating to a grant program as prescribed ,34690
LB1062,McDonnell,Indefinitely postponed,State intent relating to appropriations for the Tobacco Prevention and Control Program,34518
LB1063,McDonnell,Indefinitely postponed,Provide funding to assist victims of traumatic brain injury and increase certain driver's license fees as a source of such funding,34263
LB1064,Murante,Indefinitely postponed,Require election officials to check voter records for deceased individuals and require the Secretary of State to check the citizenship status of all registered voters and applicants to register to vote,34488
LB1065,Murante,Passed,Provide for electronic poll books and change provisions relating to digital signatures,34683
LB1065A,Murante,Indefinitely postponed,Appropriation Bill,36569
LB1066,Murante,Indefinitely postponed,Require photographic identification for purposes of voting,34480
LB1067,Quick,Indefinitely postponed,Authorize a special tourism surcharge under the Business Improvement District Act,34734
LB1068,Murante,Indefinitely postponed,"Provide for seventeen-year olds to vote in special elections, provide requirements for adjusting political subdivision boundaries, and change voter registration, special election, recall, and initiative and referendum provisions",34740
LB1069,Brasch,Indefinitely postponed,Change provisions related to the Committee on Americanism,34510
LB1070,Brewer,Passed,Change an election requirement for school districts with fewer than twenty-five students in high school grades,34696
LB1071,Lindstrom,Indefinitely postponed,Adopt the Infrastructure Improvement and Replacement Assistance Act and provide for a turn back of state sales tax revenue,34616
LB1072,Linehan,Indefinitely postponed,Change a preference in awarding public contracts and eliminate reciprocal preference provisions,34723
LB1073,Crawford,Indefinitely postponed,Provide for additional information relating to foster care placements as prescribed,34712
LB1074,Vargas,Indefinitely postponed,Change provisions relating to individual income tax brackets and rates and the earned income tax credit,34743
LB1075,Friesen,Indefinitely postponed,Impose a fee on transfers of real estate,34733
LB1076,Friesen,Indefinitely postponed,Increase the documentary stamp tax and provide for the use of the revenue,34687
LB1077,Friesen,Indefinitely postponed,Eliminate levy limits for school districts,34563
LB1078,Crawford,Passed,"Change sibling placement and other foster care requirements, change sibling visitation, require reporting of sexual abuse, and eliminate certain obsolete provisions",34778
LB1079,Howard,Indefinitely postponed,Change report provisions relating to the Children's Residential Facilities and Placing Licensure Act,34777
LB1080,Hughes,Indefinitely postponed,Provide for Wildlife Conservation Plates,34318
LB1081,Education Committee,Passed,"Change education provisions regarding reporting, penalties, residency, boundaries, priority schools, subpoena authority, poverty, and limited English proficiency and adopt the Nebraska Reading Improvement Act",34292
LB1081A,Groene,Passed,Appropriation Bill,35708
LB1082,Vargas,Indefinitely postponed,"Require jails, law enforcement agencies, and the Nebraska State Patrol to provide public notice before entering into agreements to enforce federal immigration law and to allow audits of noncomplying entities",34752
LB1083,Hansen,Indefinitely postponed,Provide for discovery of telephone numbers and email addresses of witnesses in criminal cases,34453
LB1084,Briese,Indefinitely postponed,"Adopt the Property Tax Request Limitation Act, provide sunset dates for certain tax exemptions and incentives, and change other revenue and taxation provisions",34434
LB1085,Wayne,Indefinitely postponed,Change the Community Development Law and provisions relating to tax-increment financing,34141
LB1086,Wayne,Indefinitely postponed,Provide for intervention in certain proceedings involving juveniles as prescribed,34525
LB1087,Wayne,Indefinitely postponed,"Change tax provisions for cigars, cheroots, or stogies",34649
LB1088,Wayne,Indefinitely postponed,"Adopt the Nebraska Education Formula and the Remote Seller Sales Tax Collection Act, terminate the Tax Equity and Educational Opportunities Support Act and the Property Tax Credit Act, and eliminate certain tax exemptions",34033
LB1089,Smith,Passed,"Change provisions relating to confidential tax information, refundable income tax credits, and homestead exemptions",34134
LB1090,Smith,Passed,"Change provisions relating to income tax brackets, personal exemptions, standard deductions, and itemized deductions",34666
LB1090A,Smith,Passed,Appropriation Bill,35752
LB1091,Smith,Passed,Update references to the Internal Revenue Code,34791
LB1092,Smith,Indefinitely postponed,Change provisions relating to autocycles,34779
LB1093,Walz,Indefinitely postponed,Create the office of Inspector General of Nebraska Public Health,34650
LB1094,Hilgers,Indefinitely postponed,Provide for financial literacy and entrepreneurship academic content standards,34550
LB1095,Hilgers,Indefinitely postponed,Change the information included in certain tax notices and receipts,34689
LB1096,Hilgers,Indefinitely postponed,"Change provisions relating to state vehicles and workers' compensation claims, tort claims, and other claims against the state",34352
LB1097,Hilgers,Indefinitely postponed,Change provisions relating to treasurer's tax deeds,34208
LB1098,Hilgers,Passed,Change dollar threshold for certain purchasing requirements under the County Purchasing Act,34717
LB1099,Kuehn,Indefinitely postponed,Adopt the Legislative Ethics Act,34739
LB1100,Erdman,Indefinitely postponed,Change the valuation of agricultural land and horticultural land,34433
LB1101,Vargas,Indefinitely postponed,State intent relating to appropriations to behavioral health services providers,34647
LB1102,Friesen,Indefinitely postponed,"Change provisions relating to distribution of taxes collected, license renewals and fees, and the tax on gross proceeds for county and city lotteries",34780
LB1103,Friesen,Indefinitely postponed,Provide a minimum amount of state aid for each school district,34451
LB1104,Friesen,Indefinitely postponed,Change provisions relating to the special valuation of agricultural or horticultural land,34688
LB1105,Vargas,Indefinitely postponed,Change the transaction loan period under the Delayed Deposit Services Licensing Act,34555
LB1106,Linehan,Indefinitely postponed,Change requirements for overriding property tax limits,33914
LB1107,Linehan,Indefinitely postponed,"Change provisions relating to barber licensing and the Cosmetology, Electrology, Esthetics, Nail Technology, and Body Art Practice Act",34585
LB1108,Harr,Indefinitely postponed,"Authorize certain tax credits, change the sales tax rate, and provide for school foundation aid and certain grant programs",34691
LB1109,Harr,Indefinitely postponed,Create the Grow Nebraska Through Quality Employment Strategic Partnership,34716
LB1110,Vargas,Passed,Require annual reporting of school performance scores and classifications,34469
LB1111,Stinner,Indefinitely postponed,Adopt the Fiscal Stress Management Act,34217
LB1112,Vargas,Indefinitely postponed,Change provisions relating to placement and detention of juveniles and permit an additional use of funds under the Community-based Juvenile Services Aid Program,34648
LB1113,Walz,Indefinitely postponed,"Provide an exception for leasing dark fiber or providing broadband, Internet, telecommunications, or video services by an agency or political subdivision of the state",34711
LB1114,Walz,Indefinitely postponed,Provide for creation and maintenance of a statewide geographic information system map under the Nebraska Telecommunications Regulation Act,34289
LB1115,Murante,Indefinitely postponed,"Provide population requirements for establishing district boundary lines for legislative districts, Supreme Court districts, and certain political subdivisions",34651
LB1116,Linehan,Indefinitely postponed,Create the Quality Education Accountability Commission and the Quality Education Accountability Office,34502
LB1117,Crawford,Indefinitely postponed,Change certain cigarette and tobacco products tax rates,34738
LB1118,Krist,Indefinitely postponed,Create the Coordinated Reentry Council,34701
LB1119,Riepe,Passed,Adopt the Direct Primary Care Pilot Program Act and the Nebraska Right to Shop Act,34744
LB1120,Larson,Passed,Change provisions of the Nebraska Liquor Control Act and music licensing provisions,34726
LB1121,Larson,Passed,Adopt the Nebraska Uniform Protected Series Act,34523
LB1121A,Larson,Governor Veto,Appropriation Bill,35423
LB1122,Larson,Indefinitely postponed,Authorize testing of automated motor vehicles as prescribed,34745
LB1123,Groene,Indefinitely postponed,Provide for streamflow augmentation projects and retention of water rights as prescribed ,34713
LB1124,Groene,Indefinitely postponed,Provide notice and hearing requirements for public entities relating to land acquisition and ground water pump installations,34673
LB1125,Groene,Indefinitely postponed,Change school finance base limitation and local effort rate provisions,34353
LB1126,Bolz,Indefinitely postponed,Adopt the Sexual Assault Survivors' Bill of Rights Act,34742
LB1127,Kolterman,Indefinitely postponed,Provide additional fees for certain credentials under the Uniform Credentialing Act and create the Patient Safety Cash Fund,34198
LB1128,Wayne,Indefinitely postponed,"Prohibit counties, local governments, and certain state entities from spending legislative appropriations under certain conditions",34792
LB1129,Kuehn,Indefinitely postponed,Prohibit state employees from certain political activities,34429
LB1130,Kuehn,Indefinitely postponed,Provide a disclosure requirement for certain tax-exempt organizations under the Nebraska Political Accountability and Disclosure Act,34370
LB1131,Riepe,Indefinitely postponed,Define minor child relating to dissolution of marriage statutes,34719
LB1132,Pansing Brooks,Passed,"Require certain reporting by health care providers of injury from sexual assault, provide a procedure to set aside convictions of victims of sex trafficking and to expunge records, and provide for development and distribution of a statewide model anonymous reporting protocol",34753
LB1133,Wayne,Indefinitely postponed,"Adopt the Industrial Hemp Act, provide an exemption under the Uniform Controlled Substances Act, and eliminate a provision relating to industrial hemp research",34794
LB1134,Vargas,Indefinitely postponed,Adopt the Nebraska Worker Adjustment and Retraining Notification Act,34729
LB1135,Vargas,Indefinitely postponed,Adopt the Alternative Certification for Quality Teachers Act,34692
LB1136,Clements,Indefinitely postponed,Provide for custody and disposition of certain vehicles in possession of multistate auction dealers by treating such vehicles as abandoned vehicles,34697
LR261,Albrecht,,Congratulate Michelle Helt for being named the 2018 Nebraska Teacher of the Year,33950
LR262,Albrecht,,Congratulate the Pender Elementary School on their achievements,33948
LR263,Scheer,,Congratulate the University of Nebraska Women's Volleyball team for winning the 2017 NCAA Division I volleyball championship,34325
LR264,Scheer,,Congratulate the Norfolk Catholic High School football team on winning the 2017 Class C-1 state championship,34242
LR265,Riepe,,Express appreciation for the achievements of Ralston Public Schools Superintendent Mark Adler,34138
LR266,Hughes,Referral,"Urge the U.S. Dept. of the Interior, Bureau of Reclamation, the Nebr. congressional delegation, and the Game and Parks Commission to find a solution regarding policy changes that affect Hugh Butler Lake, Harry Strunk Lake, and Swanson Reservoir",34092
LR267,Harr,,Express sympathy to the family of Helen Condon Jenkins,33985
LR268,Krist,Indefinitely postponed,Resolution to Congress for convention of the states to propose an amendment to the U.S. Constitution,34517
LR269CA,Schumacher,Indefinitely postponed,Constitutional amendment to authorize the Legislature to delegate complete or partial sovereignty to one area of the state,34039
LR270CA,Kolowski,Indefinitely postponed,Constitutional amendment to reduce the minimum age in the constitutional requirement to provide free instruction,34024
LR271,Bostelman,,Congratulate the Wahoo High School volleyball team for winning the 2017 Class C-1 state championship,34412
LR272,Bostelman,,Congratulate the East Butler High School football team for winning the 2017 Class D-1 state championship,34413
LR273,Bostelman,,Congratulate the Bishop Neumann High School softball team for winning the 2017 Class C state championship,34414
LR274,Bostelman,,Congratulate the Yutan High School football team for winning the Class C-2 state championship,34415
LR275,Riepe,,Express appreciation for the service of Linda Richards,34436
LR276,Scheer,,Recognize the thirty-fifth anniversary of Nebraska's sister-state relationship with Taiwan,34544
LR277,Schumacher,Indefinitely postponed,Rescind any previous resolutions calling for U.S. Constitution Article V conventions,34401
LR278,Quick,,Celebrate the 40th year of Husker Harvest Days,34554
LR279,Quick,,Commemorate the 130-year anniversary of the Great Blizzard of 1888 and the heroism of Minnie Freeman,34552
LR280,Stinner,,Congratulate Mayor Kent Greenwalt for receiving the Star-Herald 2017 Citizen of the Year Award,34590
LR281CA,Morfeld,Indefinitely postponed,Constitutional amendment to state that affordable health care is a right and to expand eligibility under the medical assistance program,34280
LR282,Lindstrom,,Recognize Pacific Life Insurance Company on its 150th anniversary,34530
LR283,Brasch,,Recognize Sergeant Darwin Shaw for his years of service to the citizens of Nebraska and South Carolina and congratulate him on his retirement,34592
LR284,Brasch,,Recognize Deputy Fred Carritt for his years of service to the citizens of Nebraska and congratulate him on his retirement,34593
LR285CA,Murante,Indefinitely postponed,Constitutional amendment to eliminate the State Board of Education,34492
LR286,Krist,Indefinitely postponed,Resolution proposing an election to call a state constitutional convention to amend Article VIII and other revenue provisions of the Constitution of Nebraska,34765
LR287,Quick,,Congratulate Sharon Zavala on her success and her 1000th win as volleyball coach at Grand Island Central Catholic High School,34553
LR288,Bolz,Indefinitely postponed,Create the Child Welfare Death and Abuse Special Oversight Committee of the Legislature,34439
LR289CA,Krist,Indefinitely postponed,Constitutional amendment to change and provide legislative district redistricting standards and to provide congressional district redistricting standards,34718
LR290CA,Kuehn,Indefinitely postponed,Constitutional amendment authorizing the Legislature to value real property for property tax purposes at its market value on date of acquisition,34084
LR291,Kolowski,Indefinitely postponed,"Recommend that school administrators, teachers, parents, and students be educated about the potential health impact of heavy backpacks",34020
LR292,Clements,Indefinitely postponed,Encourage Nebraskans to show respect for Nebraska and its history and encourage recitation of a pledge,34102
LR293CA,Wishart,Indefinitely postponed,"Constitutional amendment providing a right to use or consume medical cannabis subject to laws, rules, and regulations",34720
LR294CA,Larson,Indefinitely postponed,"Constitutional amendment to allow the Legislature to authorize any game of chance, lottery, or gift enterprise and to provide for distribution of revenue",34512
LR295CA,Vargas,Indefinitely postponed,Constitutional amendment to change the annual legislative salary to fifty percent of the median household income,34675
LR296,Walz,Referral,Provide the Executive Board  of the Legislative Council appoint a special committee known as the State-Licensed Care Facilities Investigative Committee of the Legislature,34710
LR297,Ebke,,Congratulate the Crete High School softball team for winning the 2017 Class B state championship,34632
LR298,McCollister,,Congratulate the Omaha Westside girls' basketball team for winning the 2017-18 Metro Holiday Tournament,34751
LR299,Kolterman,,Congratulate the York High School football team for winning the 2017 Class B state championship,34762
LR300,Kolterman,,Congratulate Jill Johnson on being honored as the 2018 Assistant Principal of the Year,34763
LR301,Hilgers,,Congratulate Jack Niemann on achieving the rank of Eagle Scout,34843
LR302,Kolterman,,Congratulate the Seward Public Schools for receiving a 2017 NebraskARTS award,34913
LR303,Albrecht,,Congratulate Jon Pickinpaugh on receiving a Milken Educator Award,34819
LR304,Lowe,,Congratulate Roger Mathiesen on his many achievements over his career as head coach for the Kearney High School boys' track team,34935
LR305,Bostelman,,Congratulate the Schuyler Community Schools for receiving the 2017 NebraskARTS Award,34942
LR306,Clements,,Congratulate Terrell Dreamer on his induction into the Nebraska Baseball Hall of Fame,34947
LR307,Clements,,Congratulate the family of Floyd Thierolf on his induction into the Nebraska Baseball Hall of Fame,34946
LR308,Pansing Brooks,,"Congratulate the educators, administrators, and students of Lincoln High School on being named one of eight Schools of Opportunity nationwide",34990
LR309,Hughes,,Congratulate the family of Bill Cotton on his induction into the Nebraska Baseball Hall of Fame,34950
LR310,Kolowski,,Congratulate Gabrielle McGinn on receiving the Gatorade Nebraska Girls Cross Country Runner of the Year,35011
LR311,Kolterman,,Congratulate the Seward High School boys' bowling team on winning the 2017 Nebraska High School Bowling Federation Class B state championship,34993
LR312,Brasch,,Congratulate James Meiergerd for his incredible backward half-court shot and for being named an honorary member of the Harlem Globetrotters,34987
LR313,Lowe,,Extend sympathy to the family and friends of Allen Zikmund,35007
LR314,Ebke,,Congratulate the Bruning-Davenport-Shickley High School football team on winning the 2017 Eight Man-2 state championship,35002
LR315,Howard,,Congratulate Evan Schroder on achieving the rank of Eagle Scout,35131
LR316,Watermeier,,Congratulate Kadynce Mullins for receiving the 2018 Prudential Spirit of Community Award,35217
LR317,Brasch,,Congratulate Anna Vaughn as a Nebraska Distinguished Finalist for the 2018 Prudential Spirit of Community Award,35216
LR318,Scheer,,Congratulate the recipients of the Distinguished NEBRASKAlander Award and extend appreciation for their service to the State of Nebraska,35400
LR319,Quick,Referral,Interim study to determine a sustainable revenue source for the Nebraska Main Street Network,35001
LR320,Baker,,Congratulate Jetta Harvey for receiving the 2018 Prudential Spirit of Community Award,35296
LR321,Baker,,Congratulate Will Gleason on winning the Number 1 singles tennis title at the 2017 Class A boys state championship,35304
LR322,Baker,,Congratulate Joe Harris on winning the Number 2 singles tennis title at the 2017 Class A boys state championship,35305
LR323,Baker,,Congratulate Duncan Works and Nick O'Shea on winning the Number 1 doubles tennis title at the 2017 Class A boys state championship,35306
LR324,Baker,,Congratulate Grady Works and Caleb Bowman on winning the Number 2 doubles tennis title at the 2017 Class boys state championship,35307
LR325,Baker,,Congratulate the Lincoln Southwest High School boys tennis team on winning the 2017 Class A state championship,35308
LR326,Stinner,,"Congratulate Paul Garcia, Garrett Nelson, and Austin Garcia on their state wrestling championships",35382
LR327,Hughes,,Congratulate Aaron Hinojosa on his state wrestling championship,35399
LR328,Kolowski,,"Recognize Friday, March 2, 2018, as National Speech and Debate Education Day in the State of Nebraska",35403
LR329,Quick,,Congratulate Jonathan Novinski on his first place finish in the boys 500-yard freestyle at the 2018 State swimming and diving championship,35521
LR330,Lowe,,"Congratulate Lee Herrington, Phillip Moomey, Nick James, and Brayden Smith on their state wrestling championships",35350
LR331,Bolz,,Recognize Ren Ferdinand for his years of service to the State of Nebraska and his contributions to improve the lives of those with developmental disabilities,35186
LR332,McDonnell,,"Recognize and celebrate the centennial of the International Association 
of Fire Fighters",35538
LR333,Krist,,Recognize March 2018 as Problem Gambling Awareness Month in Nebraska,35116
LR334,Geist,,"Congratulate the Lincoln East High School wrestling team on its state wrestling championship and Maxx Mayfield, Chance Fry, and DaShawn Dixon on their individual state wrestling titles",35474
LR335,Bostelman,,"Congratulate Melvin Hernandez, Sam Kolterman, Joseph Reimers, Seth Styskal, and Jack Sutton for their individual wrestling championships and successful seasons",35558
LR336,Bostelman,,Congratulate the Cedar Bluffs High School Cheer and Dance Team for their outstanding performance at the 2018 Nebraska State Cheer and Dance competition,35559
LR337,Bolz,,Proclaim March 2018 as Developmental Disabilities Awareness Month,35257
LR338,McCollister,,Congratulate the Omaha Westside High School girls' basketball team for winning the 2018 Class A state championship,35639
LR339,Thibodeau,Referral,Interim study to examine the issuance and usage of special designated licenses under the Nebraska Liquor Control Act pursuant to 53-124.11,35038
LR340,Watermeier,,Congratulate the Falls City Sacred Heart High School girls' basketball team on winning the 2018 Class D-2 state championship,35681
LR341,Blood,,"Recognize March 19, 2018, as Celebrating Women in Public Office Day",35679
LR342,Erdman,,Congratulate Clayton Butler for winning the 2018 Nebraska Severe Weather Awareness poster contest,35689
LR343,Clements,,Recognize March 2018 as Multiple Sclerosis Awareness Month in Nebraska,35682
LR344,Linehan,,Congratulate the Douglas County West Community Schools Robotics Team on their victory in the 2017 World Robot Conference championship,35663
LR345,Linehan,,Congratulate the Elkhorn High School girls' basketball team on winning the 2018 Class B state championship,35653
LR346,McDonnell,,"Recognize Saturday, March 17, 2018, as Timmy Conway Day in the State of Nebraska",35773
LR347,Brasch,,Extend sympathy to the family of former Governor Charley Thone and recognize his service to his state and to his country,35740
LR348,Harr,,Congratulate the Omaha Creighton Prep High School boys' basketball team on winning the 2018 Class A state championship,35814
LR349,Vargas,,"Designate March 31, 2018, as Cesar Chavez Day in Nebraska",35777
LR350,Vargas,,"Designate April 10, 2018, as Dolores Huerta Day in Nebraska",35791
LR351,Thibodeau,,Congratulate the Omaha Creighton Prep High School swimming and diving team on winning the 2018 state boys' championship,35864
LR352,Lindstrom,Referral,Interim study to determine whether the Real Property Appraiser Act should be updated,35667
LR353,Lowe,Referral,Interim study to determine the feasibility and fiscal impact of hiring outside consultants to perform an efficiency review of state agencies,35769
LR354,Watermeier,,Congratulate the Lourdes Central Catholic High School boys' basketball team on winning the 2018 Class D-1 state championship,35846
LR355,Watermeier,,Congratulate the Falls City Sacred Heart High School boys' basketball team on winning the 2018 Class D-2 state championship,35845
LR356,Brasch,,"Designate March 21, 2018, as Down Syndrome Awareness Day in Nebraska",36039
LR357,Kolowski,Referral,Interim study to examine the current status of early childhood education,36009
LR358,Thibodeau,,Congratulate the Omaha Creighton Prep academic decathlon team on winning the 2018 Nebraska Academic Decathlon,35906
LR359,Bostelman,,Congratulate the Wahoo High School boys' basketball team for winning the 2018 Class C-1 state championship,35891
LR360,Harr,,Express sympathy to the family of Justice John F. Wright,36072
LR361,Pansing Brooks,Referral,Interim study to examine the extent of the parking shortage in the Capitol environs,36018
LR362,Groene,Referral,Interim study to examine issues under the jurisdiction of the Education Committee,36008
LR363,Walz,,Congratulate Soil Analytics for their contributions to the Fremont community and for their excellence in agriculture,36068
LR364,Walz,,Congratulate Butler Ag Equipment for their significant contribution to the Fremont community and for their excellence in agriculture,36067
LR365,Walz,,Congratulate Scott Wagner and his family for their contribution to the community and for their excellence in agriculture,36066
LR366,Kolterman,,Congratulate the York High School boys' basketball team on winning the 2018 Class B state championship,36077
LR367,Hansen,,Congratulate the Nebraska Wesleyan University men's basketball team for winning the 2018 NCAA Division III championship,36085
LR368,Kolterman,Referral,Interim study to examine the public employees' retirement systems administered by the Public Employees Retirement Board,36166
LR369,Kolterman,Referral,Interim study to carry out the provisions of 13-2402 which require the Nebraska Retirement Systems Committee to monitor underfunded defined benefit plans administered by political subdivisions,36167
