Document,Primary Introducer,Status,Description,Document ID
LB870,Pansing Brooks,Indefinitely postponed,Provide for room confinement for juveniles as prescribed ,33867
LB871,Wishart,Indefinitely postponed,Appropriate funds to the Department of Correctional Services,33956
LB872,Harr,Indefinitely postponed,Change provisions relating to appeals by prosecutors,34214
LB873,Urban Affairs Committee,Governor Veto,"Change provisions relating to cities of particular classes and villages, correct and include references as prescribed, eliminate obsolete provisions and repeal definitions, provide for interlocal nuisance agreements, to determine population thresholds, redefine certain economic development programs, authorize creation of additional land banks, change comprehensive plans for an early childhood element, authorize short-term rentals, and change provisions relating to the official state slogan and symbol",33944
LB874,Urban Affairs Committee,Passed,Change the Community Development Law,34010
LB875,Bolz,Indefinitely postponed,Change sentencing provisions for crimes committed by persons under the age of eighteen,34237
LB876,Kolowski,Indefinitely postponed,Change special education reimbursements,34025
LB877,Kolowski,Indefinitely postponed,Change provisions related to early childhood education in the Tax Equity and Educational Opportunities Support Act,34155
LB878,Ebke,Indefinitely postponed,Provide requirements for testimony by jailhouse informants,34070
LB879,Ebke,Indefinitely postponed,Provide for a parenting time summary report,34067
LB880,Hansen,Indefinitely postponed,Provide for an early childhood element in a comprehensive plan developed by a city,34123
LB881,Schumacher,Indefinitely postponed,Change inheritance tax provisions relating to life insurance proceeds,34000
LB882,Schumacher,Indefinitely postponed,Change provisions relating to certain inheritance tax proceedings,34001
LB883,Harr,Indefinitely postponed,Provide for appointment of independent counsel to prosecute crimes by state officials or employees and change powers and duties of the Attorney General,34080
LB884,Harr,Indefinitely postponed,Change and eliminate provisions relating to county sales and use taxes,34127
LB885,Harr,Passed,Change provisions relating to property tax protests,34019
LB886,Morfeld,Indefinitely postponed,Protect student journalists' and student media advisers' rights of and freedom of speech and of the press,33930
LB887,Murante,Indefinitely postponed,Clarify requirements for exceeding budget limitations under the Nebraska Budget Act,34489
LB888,Wayne,Indefinitely postponed,Require schools to post the child abuse and neglect toll-free telephone number,34511
LB889,Wayne,Passed,Provide and eliminate duties relating to fire codes,33965
LB890,Wayne,Indefinitely postponed,Provide for a fee examination and report relating to the State Fire Marshal,34437
LB891,Pansing Brooks,Indefinitely postponed,Prohibit discrimination in the provision of services as prescribed under the Psychology Practice Act,34334
LB892,Howard,Indefinitely postponed,Prohibit restraining animals in the event of certain natural or manmade disasters or severe weather events as prescribed,34072
LB893,Wishart,Indefinitely postponed,Change seller disclosure statement requirements and provide for restrictions and duties on pet shop owners under the Dog and Cat Purchase Protection Act,34131
LB894,Crawford,Indefinitely postponed,Adopt the EMS Personnel Licensure Interstate Compact,34052
LB894A,Blood,Indefinitely postponed,Appropriation Bill,36027
LB895,Geist,Indefinitely postponed,Change lien and flood-damaged brand provisions relating to motor vehicle certificates of title and change duties and requirements of the Department of Motor Vehicles as prescribed,33966
LB896,Geist,Indefinitely postponed,"Change provisions relating to electronic certificates of title, salvage vehicles, and the electronic dealer services system and Vehicle Title and Registration System maintained by the Department of Motor Vehicles",34137
LB897,Howard,Indefinitely postponed,Change medical providers' duties under offense of failure to report injury or violence,34164
LB898,Howard,Indefinitely postponed,Require public postsecondary educational institutions to conduct an annual sexual assault climate survey,34163
LB899,Erdman,Indefinitely postponed,Provide for an adjustment to the assessed value of destroyed real property,34294
LB900,Bostelman,Indefinitely postponed,Adopt and update references to federal law relating to transportation and increase fines for violations of certain motor carrier statutes and regulations,34149
LB901,Bostelman,Passed,Change permit application and issuance requirements relating to regulation of certain structures by the Division of Aeronautics of the Department of Transportation and provide a duty for the Nebraska National Guard,34447
LB902,Bostelman,Passed,"Authorize the withholding from the public of information regarding firearm registration, possession, sale, or use",34506
LB903,Linehan,Passed,Change provisions relating to the Nebraska Community Aging Services Act and the Long-Term Care Ombudsman Act,33934
LB904,Vargas,Indefinitely postponed,Prohibit the charging of certain fees under the Credit Services Organization Act,34087
LB905,Kuehn,Indefinitely postponed,Change the burden of proof for certain protests of real property valuations,33898
LB906,Williams,Passed,Change provisions relating to the schedules of controlled substances,34078
LB907,Baker,Indefinitely postponed,Change provisions relating to a sales and use tax exemption for agricultural machinery and equipment,33901
LB908,Baker,Indefinitely postponed,Provide a disposal exception for tires used in a building system and eliminate obsolete provisions under the Integrated Solid Waste Management Act,34452
LB909,Bostelman,Passed,"Change provisions relating to motor carriers, hazardous materials regulations, and  titling, registration, sales, and operation of motorboats and motor vehicles",34449
LB910,Bolz,Indefinitely postponed,Adopt the Property Tax Circuit Breaker Act and change the funding of the Property Tax Credit Act,34228
LB911,Bolz,Indefinitely postponed,Adopt the School District Local Option Income Surtax Act,34349
LB912,McCollister,Indefinitely postponed,Provide for posting by public schools of a toll-free telephone number set up to report child abuse and neglect,34536
LB913,McDonnell,Passed,Change provisions relating to assault with a bodily fluid against a public safety officer to include a health care professional,34462
LB914,Riepe,Indefinitely postponed,Provide an income tax credit for certain long-term care insurance policy premiums,34048
LB915,Riepe,Withdrawn,Change prohibitions on using handheld wireless communication devices or handheld mobile telephones while driving,34171
LB916,Hansen,Indefinitely postponed,Prohibit retaliation under the Nebraska Wage Payment Collection Act and the Wage and Hour Act,34056
LB917,Bolz,Indefinitely postponed,Change eligibility relating to the Community College Gap Assistance Program Act,34192
LB918,Bolz,Indefinitely postponed,Change provisions relating to certain tax incentive programs and job training grants,34206
LB919,Bolz,Indefinitely postponed,Adopt the Student Loan Repayment Tax Credit Act and change certain taxation and grant provisions,34556
LB920,Bolz,Indefinitely postponed,Change provisions relating to a child and dependent care tax credit,34473
LB921,Lowe,Indefinitely postponed,Create a licensing exception under the State Electrical Act for certain farm building construction,34515
LB922,Vargas,Indefinitely postponed,Adopt the All Kids Health Care Program Act,34421
LB923,Morfeld,Passed,Provide immunity for certain law enforcement employees administering naloxone and change provisions relating to immunity for persons reporting or experiencing alcohol overdoses,34471
LB924,Riepe,Indefinitely postponed,"Change provisions of the Emergency Medical Services Practice Act, the Occupational Therapy Practice Act, and the Uniform Credentialing Act",34179
LB925,Pansing Brooks,Indefinitely postponed,Change provisions relating to certain sex crimes and crimes against children,33874
LB926,Crawford,Indefinitely postponed,Exempt members of the armed forces on active duty and their spouses from motor vehicle taxes,34499
LB927,Howard,Indefinitely postponed,"Change provisions relating to juveniles' out-of-home placement, care, and custody",34182
LB928,McDonnell,Indefinitely postponed,Change provisions relating to compensation paid upon the death of an employee under the Nebraska Workers' Compensation Act,34108
LB929,Brewer,Indefinitely postponed,State rights of Nebraska National Guard members and provide that a residential address may be withheld from the public,34540
LB930,Hansen,Indefinitely postponed,Prohibit use of juveniles' statements made as a result of custodial interrogation,34059
LB931,Howard,Passed,Provide requirements for opiate and controlled substance prescriptions,34043
LB932,Howard,Indefinitely postponed,Provide discharge planning duties for the medical director of the Department of Correctional Services,34167
LB933,Lindstrom,Indefinitely postponed,Provide prescription requirements for certain controlled substances,34073
LB934,Kuehn,Indefinitely postponed,Require identification prior to receipt of dispensed opiates,34091
LB935,Legislative Performance Audit Committee,Indefinitely postponed,"Authorize the inspection of certain tax return information and change application, reporting, and record retention provisions under the Nebraska Advantage Act",34224
LB935A,Kuehn,Indefinitely postponed,Appropriation Bill,35747
LB936,Legislative Performance Audit Committee,Passed,Change provisions relating to tax incentive performance audits under the Legislative Performance Audit Act,34574
LB937,Stinner,Indefinitely postponed,Change filing fees for appeals to the Tax Equalization and Review Commission,34466
LB938,Stinner,Indefinitely postponed,Change provisions relating to the transfer of excess General Fund net receipts to the Cash Reserve Fund,34241
LB939,McDonnell,Indefinitely postponed,Provide a homestead exemption for certain dwelling complexes located on military installations,33980
LB940,Friesen,Passed,"Change provisions of the Civic and Community Center Financing Act relating to fund use, grant request limits, property sale restrictions, and grant application priority",34330
LB940A,Friesen,Passed,Appropriation Bill,35075
LB941,Wayne,Indefinitely postponed,Change the calculation of the tax on the average wholesale price of gasoline,34332
LB942,Wayne,Indefinitely postponed,Adopt the Metropolitan Port Authority Act,34226
LB943,Wishart,Indefinitely postponed,Redefine a term relating to budget limitations,34275
LB944,Speaker Scheer,Passed,"Provide, change, and eliminate provisions relating to appropriations and reduce appropriations",34302
LB945,Speaker Scheer,Passed,"Create funds and authorize, change, provide, and eliminate fund transfer provisions",34303
LB946,Speaker Scheer,Passed,Change provisions relating to the Cash Reserve Fund,34304
LB947,Smith,Indefinitely postponed,"Adopt the Nebraska Property Tax Cuts and Opportunities Act, change income tax rates, and eliminate certain exemptions and credits",34496
LB947A,Smith,Indefinitely postponed,Appropriation Bill,36148
LB948,Murante,Indefinitely postponed,Change and eliminate provisions relating to rules and regulations,34135
LB949,Albrecht,Indefinitely postponed,"Rename the Nebraska Educational, Health, and Social Services Finance Authority Act and apply the act to cultural institutions",34541
LB950,Albrecht,Passed,Provide for payment of claims against the state,34418
LB951,Albrecht,Indefinitely postponed,Deny claims against the state,34419
LB952,Albrecht,Indefinitely postponed,Change provisions relating to dismissals of actions under the Nebraska Workers' Compensation Act,34234
LB953,Albrecht,Passed,Change provisions under the Nebraska Workers' Compensation Act and the Employee Classification Act,34233
LB954,Hansen,Indefinitely postponed,Provide refundable income tax credits to individuals who rent their primary residence,34060
LB955,Krist,Indefinitely postponed,Provide for reciprocal certification of military police officers and law enforcement officers from other jurisdictions,34542
LB956,Howard,Indefinitely postponed,Require application for a demonstration project to allow purchase of medicaid coverage,34160
LB957,Lowe,Passed,Provide procedures for choosing a method of payment for payments under the Nebraska Workers' Compensation Act,34305
LB958,Erdman,Indefinitely postponed,Provide for licensure of a vehicle as a massage therapy establishment,34519
LB959,Murante,Indefinitely postponed,Provide requirements for returning a ballot for someone else and provide a penalty,34566
LB960,Murante,Indefinitely postponed,Change provisions of the Nebraska Political Accountability and Disclosure Act,34538
LB961,Smith,Indefinitely postponed,Change corporate income tax rates,34584
LB962,Smith,Indefinitely postponed,Change individual income tax rates,34586
LB963,Smith,Indefinitely postponed,Change how often real property is inspected and reviewed for property tax purposes,34588
LB964,McDonnell,Indefinitely postponed,Authorize mental health professionals to take a person into emergency protective custody under the Nebraska Mental Health Commitment Act,34281
LB965,Schumacher,Indefinitely postponed,Change provisions relating to lists of real property subject to sale for delinquent taxes,34211
LB966,Friesen,Indefinitely postponed,Provide a sales and use tax exemption relating to dark fiber,34207
LB967,Groene,Indefinitely postponed,Eliminate provisions of the Community Development Law relating to undeveloped vacant land and land outside of cities,34369
LB968,Wayne,Indefinitely postponed,Adopt the Disability Employment and Engagement Program Act,34513
LB969,Wayne,Indefinitely postponed,Change signature requirements for nomination of partisan candidates by petition,34558
LB970,Wayne,Indefinitely postponed,Change marijuana penalties as prescribed,34606
LB971,Wayne,Indefinitely postponed,Change a penalty for possession under the Uniform Controlled Substances Act,34605
LB972,Wayne,Indefinitely postponed,Provide for deferred judgments by courts,34604
LB973,Crawford,Indefinitely postponed,Require use of redistricting maps drawn using state-issued computer software,34347
LB974,Vargas,Indefinitely postponed,"Prohibit consideration of political affiliation, demographic information, and previous election results in drawing legislative districts",34348
LB975,Howard,Indefinitely postponed,Adopt the Redistricting Act,34175
LB976,Briese,Indefinitely postponed,Provide a reporting duty for the Beginning Farmer Board under the Beginning Farmer Tax Credit Act,34578
LB977,Wayne,Indefinitely postponed,Make post-release supervision optional for Class IV felonies,34375
LB978,Harr,Indefinitely postponed,Change provisions relating to garnishment,33924
LB979,Crawford,Indefinitely postponed,Authorize physician assistants and nurse practitioners to render expert opinions,34546
LB980,Watermeier,Indefinitely postponed,Provide for issuance of permits for divisible loads of hay bales,34430
LB981,Baker,Indefinitely postponed,Change provisions relating to arraignment of juveniles and authorize juvenile court jurisdiction to age twenty-one with consent of the juvenile and legal counsel,34557
LB982,Morfeld,Passed,Provide for persons eighteen years of age or older to consent to certain behavioral health services,34595
LB983,Ebke,Passed,Change provisions relating to audiovisual court appearances,34615
LB984,Quick,Indefinitely postponed,Change provisions of the Nebraska Lottery and Raffle Act relating to special permits and gross proceeds,34531
LB985,Howard,Indefinitely postponed,Provide for state funding of prenatal care under the medical assistance program,34265
LB986,Hansen,Indefinitely postponed,Adopt the Neighborhood Improvement District Act and change provisions relating to special assessments for other improvement or development districts as prescribed,34248
LB987,Schumacher,Indefinitely postponed,Adopt the Uniform Regulation of Virtual-Currency Businesses Act,34121
LB988,Pansing Brooks,Indefinitely postponed,Adopt an affirmative consent standard with respect to sexual assault,34420
LB989,Wishart,Passed,"Authorize automated-driving-system-equipped vehicles, automated driving systems, and driverless-capable vehicles as prescribed",34326
LB990,Wayne,Passed,Create the offense of possession of a firearm by a prohibited juvenile offender,34458
LB990A,Wayne,Passed,Appropriation Bill,35964
LB991,Bolz,Indefinitely postponed,Create the Nebraska Integrated Education and Training Grant Program,34537
LB992,Bolz,Indefinitely postponed,Provide for release from a residential lease for a victim of domestic violence and eviction of a perpetrator of domestic violence,34386
LB993,Friesen,Passed,"Add, change, and eliminate provisions relating to 911 service system planning and funding",34446
LB993A,Friesen,Passed,Appropriation Bill,35965
LB994,Friesen,Passed,Create the Rural Broadband  Task Force and exempt dark fiber from sales tax,34425
LB994A,Friesen,Passed,Appropriation Bill,36035
LB995,Linehan,Indefinitely postponed,Require the filing of a statement of financial interests by individuals holding elective office of a school district under the Nebraska Political Accountability and Disclosure Act,33909
LB996,Crawford,Indefinitely postponed,Change defined terms and other provisions of the Nebraska Advantage Act,34235
LB997,Murante,Indefinitely postponed,Provide limits on salaries of administrative employees of political subdivisions,34485
LB998,Walz,Governor Veto,Create the Collaborative School Behavioral and Mental Health Program,34288
LB999,Vargas,Indefinitely postponed,Change provisions relating to the Student Discipline Act,34424
LB1000,Briese,Passed,Require a bond election under the Public Facilities Construction and Finance Act,34142
LB1001,Briese,Indefinitely postponed,Provide for a review of the financing of schools,34358
LB1002,Wishart,Indefinitely postponed,Create the Nebraska Film Office Fund,34581
LB1003,McDonnell,Passed,Change leave of absence without loss of pay provisions under the Military Code,34686
LB1004,Bolz,Indefinitely postponed,Provide for aging and disability resource centers as prescribed and eliminate references to demonstration projects,34116
LB1005,Kolterman,Passed,Change retirement provisions and University Trust Fund investment provisions,34379
LB1006,McCollister,Indefinitely postponed,Change provisions relating to rehearings under the Tax Equalization and Review Commission Act,34607
LB1007,Kolowski,Indefinitely postponed,Authorize school districts to levy a tax and establish a fund for facilities-related expenditures,34528
LB1008,Bostelman,Passed,"Change provisions relating to the Game Law, the compensation of certain commission members, the withholding of certain competitive information, certain privately developed renewable energy generation facilities, and certain scrap tire projects",34509
LB1009,Murante,Passed,Change a rural highway classification and maximum highway speed limits as prescribed,33960
LB1010,Hansen,Indefinitely postponed,Change procedures for determining competency to stand trial in counties containing a city of the primary class,34012
LB1011,Harr,Indefinitely postponed,Provide a duty for drivers approaching certain stopped vehicles on a roadway as prescribed under the Nebraska Rules of the Road,34594
LB1012,Harr,Passed,Authorize self-service storage facility operator insurance producer licenses,34468
LB1013,Pansing Brooks,Indefinitely postponed,Limit the habitual criminal enhancement to violent felonies,34679
LB1014,Pansing Brooks,Indefinitely postponed,"Name the Discriminatory Wage Practices Act, change provisions relating to wage discrimination on the basis of sex, and provide protections for employees relating to wage disclosure",34601
LB1015,Briese,Indefinitely postponed,Allow withholding from public of reports of injury under the Nebraska Workers' Compensation Act that reveal an employee's identity,34231
LB1016,Briese,Indefinitely postponed,Adopt the Money Transmission Fee Act and provide income tax credits,34597
LB1017,Krist,Withdrawn,Change and eliminate pipeline siting provisions and eminent domain provisions,34503
LB1018,Geist,Indefinitely postponed,"Provide for inadmissibility of audio and video recordings of legislative proceedings, require a notice regarding prohibited uses of such recordings, and provide that such recordings are not public records",34287
LB1019,Clements,Indefinitely postponed,Change boundaries of Nebraska planning and development regions,34529
LB1020,Crawford,Indefinitely postponed,Change provisions relating to limits on indebtedness from direct borrowing by cities and villages,34625
LB1021,Schumacher,Indefinitely postponed,Eliminate certain sales and use tax exemptions,34346
LB1022,Schumacher,Indefinitely postponed,Adopt the Irrigation Tax Act and change the valuation of agricultural land for property tax purposes,34038
LB1023,Schumacher,Indefinitely postponed,Change sunset dates on certain tax incentive programs,34464
LB1024,Wayne,Indefinitely postponed,Change references from Big Twelve Conference to Big Ten Conference in provisions requiring a stipend or restricting hours of participation for intercollegiate athletes,34659
LB1025,Wayne,Indefinitely postponed,Create the Building Codes Advisory Committee and change building code provisions,34036
LB1026,Wayne,Indefinitely postponed,"Authorize issuance of highway bonds, create a fund, and change existing highway funding provisions",34514
LB1027,Wayne,Indefinitely postponed,Provide for restoration of voting rights upon completion of a felony sentence or probation for a felony,34656
LB1028,Wayne,Indefinitely postponed,Adopt the Abandoned and Dilapidated Housing Act,34474
LB1029,Hansen,Indefinitely postponed,Change time for acceptance of a power of attorney,34003
LB1030,Friesen,Passed,Change the sales tax sourcing rules for certain motor vehicles and trailers,34427
LB1031,Friesen,Indefinitely postponed,"Change excavation notification and marking requirements and provide for large project planning meetings, rulemaking authority, and cost allocation under the One-Call Notification System Act",34172
LB1032,Murante,Indefinitely postponed,Provide for a statewide presidential primary election,34487
LB1033,Murante,Indefinitely postponed,Eliminate learning communities,34278
LB1034,Riepe,Passed,Change credentialing provisions for health care professions and occupations and licensure provisions for health care facilities and services and school-age child care programs and adopt the EMS Personnel Licensure Interstate Compact and the Psychology Interjurisdictional Compact,34440
LB1034A,Riepe,Passed,Appropriation Bill,36247
LB1035,Riepe,Indefinitely postponed,Change provisions relating to the Stroke System of Care Act,34746
LB1036,Kolowski,Passed,Change the expenditure limit for a recognition dinner under the Local Government Miscellaneous Expenditure Act,34703
LB1037,Baker,Indefinitely postponed,Change provisions of the Nebraska Political Accountability and Disclosure Act relating to a potential conflict of interest by an elected office holder of certain cities or villages or a school district,34702
LB1038,Thibodeau,Passed,Provide a deadline for electronic voter registration,34306
LB1039,Linehan,Indefinitely postponed,Increase the amount that may be required for a pet deposit under the Uniform Residential Landlord and Tenant Act,34619
LB1040,Albrecht,Passed,Provide for commemorative certificates of nonviable birth,34565
LB1041,Wishart,Indefinitely postponed,Require specific training for foster care licensees on sexual abuse,34608
LB1042,Howard,Indefinitely postponed,Change and eliminate provisions relating to nail technology,34573
LB1043,Lowe,Indefinitely postponed,Change provisions relating to reimbursement of common and contract carriers for transportation costs associated with certain agency clients as prescribed,34708
LB1044,Krist,Indefinitely postponed,Change provisions relating to providing social services relating to child abuse and neglect investigations,34677
LB1045,Schumacher,Indefinitely postponed,Adopt the Nebraska Excellence Fund Tax Credit Act,34735
LB1046,Bolz,Indefinitely postponed,Provide for a caseload ratio emergency declaration relating to health and human services,34732
LB1047,Harr,Indefinitely postponed,Change provisions under the Nebraska Uniform Power of Attorney Act relating to banks and other financial institutions,34002
LB1048,Harr,Indefinitely postponed,Change provisions relating to the personal exemption credit,34626
LB1049,Harr,Indefinitely postponed,Redefine low-speed vehicle,34461
LB1050,Harr,Indefinitely postponed,Provide an adjustment to income for certain charitable contributions,34609
LB1051,Pansing Brooks,Indefinitely postponed,Change provisions relating to family member visitation,34103
LB1052,Pansing Brooks,Passed,Require instruction and teacher education related to dyslexia,34380
LB1053,Wishart,Indefinitely postponed,Provide for a 10-year strategic plan by the Legislature's Planning Committee,34539
LB1054,Brewer,Indefinitely postponed,Change provisions relating to hearings before the Nebraska Power Review Board and electric generation using wind,34567
LB1055,Crawford,Indefinitely postponed,Create the Intern Nebraska Cash Fund and state intent regarding appropriations,34428
LB1056,Hansen,Indefinitely postponed,Provide for collection of data on student disciplinary actions,34603
LB1057,Kuehn,Indefinitely postponed,Change provisions relating to prescription drug monitoring,34663
LB1058,Halloran,Indefinitely postponed,Adopt the Faithful Delegate to Federal Article V Convention Act,34505
